{
  "schema": "ophiolite.well-path/1",
  "representation": "normalized",
  "source": {
    "authority": "ophiolite:uploaded",
    "key": "synthetic-well-path",
    "revision": "6eb011569f7c4dc996b5d60ea96f724d60e575a3238b237f420c35a64c29af6b",
    "profile": "well-path-positions-csv/1"
  },
  "source_sha256": "6eb011569f7c4dc996b5d60ea96f724d60e575a3238b237f420c35a64c29af6b",
  "interpretation": {
    "reader": "asset_connectors.typed_reader/1",
    "mapping": "well-path/1",
    "parsing_policy": "typed-strict/1",
    "null_policy": "empty cell or declared NODATA value is missing; never zero-filled"
  },
  "context": {
    "type": "well-path",
    "crs": "EPSG:23031",
    "xy_unit": "m",
    "depth_unit": "m",
    "md_reference": "KB",
    "tvdss_datum": "MSL",
    "count": 5,
    "md_range": [
      0.0,
      1100.25
    ],
    "tvdss_range": [
      -12.5,
      610.75
    ],
    "fidelity": {
      "status": "assessed",
      "preserved": [
        "measured depths",
        "eastings and northings as numbers",
        "TVDSS as numbers",
        "station order",
        "the declared coordinate system, units and datums"
      ],
      "losses": [
        "Text formatting (whitespace, quoting, line endings, number spelling) is kept only in the exact original"
      ],
      "unknown_context": []
    }
  },
  "stations": [
    {
      "md": 0.0,
      "x": 1000.0,
      "y": 2000.0,
      "tvdss": 50.0
    },
    {
      "md": 150.0,
      "x": 1000.0,
      "y": 2000.0,
      "tvdss": -12.5
    },
    {
      "md": 400.5,
      "x": 1003.25,
      "y": 2010.5,
      "tvdss": 300.25
    },
    {
      "md": 800.0,
      "x": 1010.0,
      "y": 2030.0,
      "tvdss": 610.75
    },
    {
      "md": 1100.25,
      "x": 1020.5,
      "y": 2055.25,
      "tvdss": 480.5
    }
  ]
}
